{
 "$schema": "https://json-schema.org/draft/2020-12/schema",
 "items": {
  "properties": {
   "agency": {
    "type": "string"
   },
   "country": {
    "type": "string"
   },
   "exploitation": {
    "type": "string"
   },
   "note": {
    "type": "string"
   },
   "offline": {
    "type": "string"
   },
   "offline_text": {
    "type": "string"
   },
   "published": {
    "type": "string"
   },
   "sources": {
    "items": {
     "type": "string"
    },
    "type": "array"
   }
  },
  "required": [
   "agency",
   "country",
   "exploitation",
   "note",
   "offline",
   "offline_text",
   "published",
   "sources"
  ],
  "type": "object"
 },
 "title": "agencies.json",
 "type": "array"
}
